name,title,type,example,description,table_sources,metadata,longitudinal,analysis
TotHcv,Yearly Hepatitis C cases (2013-2016),number,54200,Mean total yearly Hepitatis C cases from 2013-2016,state-2017,HepatitisC_Rates,False,False
TotPcp,Count of Primary Care Physicians (PCPs),integer,5904,Number of primary care providers in area,"county-providers-2010, state-providers-2010, tract-providers-2010",Healthcare_Provider_Access,False,False
TotPop,Total Population,integer,1632480,Total population,"county-1980, county-1990, county-2000, county-2010, county-2018, county-2020, county-2023, state-1980, state-1990, state-2000, state-2010, state-2018, state-2023, tract-1980, tract-1990, tract-2000, tract-2010, tract-2018, tract-2020, tract-2023, zcta-2018, zcta-2020, zcta-2023",Demographic_Characteristics,True,False
TotPopHh,Total Population in Households,integer,7151776,Total number of people in households,"county-2018, county-2020, county-2023, state-2018, tract-2018, tract-2020, tract-2023, zcta-2018, zcta-2020, zcta-2023",Household_Characteristics,False,False
TotSp,Count of Specialty Physicians,integer,9499,Number of specialty physicians in area,"county-providers-2010, state-providers-2010, tract-providers-2010",Healthcare_Provider_Access,False,False
TotTracts,Total Census Tract Count,integer,1458,Total number of census tracts within the state.,"county-2018, county-2025, state-2018, state-2025",Access_FQHCs,False,False
TotUnits,Total Occupied Housing Units,integer,874237,Count of total occupied housing units,"county-1980, county-1990, county-2000, county-2010, county-2018, county-2020, county-2023, state-1980, state-1990, state-2000, state-2010, state-2018, tract-1980, tract-1990, tract-2000, tract-2010, tract-2018, tract-2020, tract-2023, zcta-2018, zcta-2020, zcta-2023",Housing_Variables,True,False
TotVetPop,Total Veteran Population,integer,537713,Total Veteran population,"county-2010, county-2018, county-2020, county-2023, state-2010, state-2018, tract-2010, tract-2018, tract-2020, tract-2023, zcta-2018, zcta-2020, zcta-2023",Veteran_Population,False,False
TotWrkE,Count of Working Population,integer,3513856,Estimated count of working population,"county-2018, county-2020, county-2023, state-2018, tract-2018, tract-2020, tract-2023, zcta-2018, zcta-2020, zcta-2023",Employment_Trends,False,False
TradFedExp,Traditional Medicaid Federal Spending,integer,4610569600,Traditional medicaid - federal spending,"state-2018, state-2023",Medical_Expenditures,False,False
TradSttExp,Traditional Medicaid State Spending,integer,4349828600,Traditional medicaid - state spending,"state-2018, state-2023",Medical_Expenditures,False,False
TtlJlAdm,"Total Jail Admissions Count, ASJ/COJ Data",number,72266,"Total Jail Admissions Count, ASJ/COJ Data","county-2017, county-2024, state-2022",Jail_Incarceration_Rates,False,False
TtlJlAdmQ1,"Total Jail Admissions Count (Q1), ASJ/COJ Data",number,72266,"Total Jail Admissions Count (Q1), ASJ/COJ Data",county-2023,Jail_Incarceration_Rates,False,False
TtlJlAdmQ2,"Total Jail Admissions Count (Q2), ASJ/COJ Data",number,72266,"Total Jail Admissions Count (Q2), ASJ/COJ Data",county-2023,Jail_Incarceration_Rates,False,False
TtlJlAdmQ3,"Total Jail Admissions Count (Q3), ASJ/COJ Data",number,72266,"Total Jail Admissions Count (Q3), ASJ/COJ Data",county-2023,Jail_Incarceration_Rates,False,False
TtlJlAdmQ4,"Total Jail Admissions Count (Q4), ASJ/COJ Data",number,72266,"Total Jail Admissions Count (Q4), ASJ/COJ Data",county-2023,Jail_Incarceration_Rates,False,False
TtlJlAdmr,Total jail admission rate,number,1260.84,"Total Jail Admissions Rate, ASJ/COJ Data","county-2017, county-2024, state-2022",Jail_Incarceration_Rates,False,False
TtlJlAdmrQ1,Total jail admission rate (Q1),number,1260.84,"Total Jail Admissions Rate (Q1), ASJ/COJ Data",county-2023,Jail_Incarceration_Rates,False,False
TtlJlAdmrQ2,Total jail admission rate (Q2),number,1260.84,"Total Jail Admissions Rate (Q2), ASJ/COJ Data",county-2023,Jail_Incarceration_Rates,False,False
TtlJlAdmrQ3,Total jail admission rate (Q3),number,1260.84,"Total Jail Admissions Rate (Q3), ASJ/COJ Data",county-2023,Jail_Incarceration_Rates,False,False
TtlJlAdmrQ4,Total jail admission rate (Q4),number,1260.84,"Total Jail Admissions Rate (Q4), ASJ/COJ Data",county-2023,Jail_Incarceration_Rates,False,False
TtlJlPp,"Total Jail Population Count, ASJ/COJ Data",number,13201,"Total Jail Population Count, ASJ/COJ Data","county-2017, county-2024, state-2022, state-2023",Jail_Incarceration_Rates,False,False
TtlJlPpQ1,"Total Jail Population Count (Q1), ASJ/COJ Data",number,13201,"Total Jail Population Count (Q1), ASJ/COJ Data",county-2023,Jail_Incarceration_Rates,False,False
TtlJlPpQ2,"Total Jail Population Count (Q2), ASJ/COJ Data",number,13201,"Total Jail Population Count (Q2), ASJ/COJ Data",county-2023,Jail_Incarceration_Rates,False,False
TtlJlPpQ3,"Total Jail Population Count (Q3), ASJ/COJ Data",number,13201,"Total Jail Population Count (Q3), ASJ/COJ Data",county-2023,Jail_Incarceration_Rates,False,False
TtlJlPpQ4,"Total Jail Population Count (Q4), ASJ/COJ Data",number,13201,"Total Jail Population Count (Q4), ASJ/COJ Data",county-2023,Jail_Incarceration_Rates,False,False
TtlJlPpr,Total Jail Population Rate,number,230.32,"Total Jail Population Rate, ASJ/COJ Data","county-2017, county-2024, state-2022, state-2023",Jail_Incarceration_Rates,False,False
TtlJlPprQ1,Total Jail Population Rate (Q1),number,230.32,"Total Jail Population Rate (Q1), ASJ/COJ Data",county-2023,Jail_Incarceration_Rates,False,False
TtlJlPprQ2,Total Jail Population Rate (Q2),number,230.32,"Total Jail Population Rate (Q2), ASJ/COJ Data",county-2023,Jail_Incarceration_Rates,False,False
TtlJlPprQ3,Total Jail Population Rate (Q3),number,230.32,"Total Jail Population Rate (Q3), ASJ/COJ Data",county-2023,Jail_Incarceration_Rates,False,False
TtlJlPprQ4,Total Jail Population Rate (Q4),number,230.32,"Total Jail Population Rate (Q4), ASJ/COJ Data",county-2023,Jail_Incarceration_Rates,False,False
TtlJlPrt,Pretrial Jail Population Count,number,6150,Pretrial Jail Population Count,"county-2017, county-2024, state-2022, state-2023",Jail_Incarceration_Rates,False,False
TtlJlPrtQ1,Pretrial Jail Population Count (Q1),number,6150,Pretrial Jail Population Count (Q1),county-2023,Jail_Incarceration_Rates,False,False
TtlJlPrtQ2,Pretrial Jail Population Count (Q2),number,6150,Pretrial Jail Population Count (Q2),county-2023,Jail_Incarceration_Rates,False,False
TtlJlPrtQ3,Pretrial Jail Population Count (Q3),number,6150,Pretrial Jail Population Count (Q3),county-2023,Jail_Incarceration_Rates,False,False
TtlJlPrtQ4,Pretrial Jail Population Count (Q4),number,6150,Pretrial Jail Population Count (Q4),county-2023,Jail_Incarceration_Rates,False,False
TtlJlPrtr,Pretrial Jail Population Rate,number,107.3,Pretrial Jail Population Rate,"county-2017, county-2024, state-2022, state-2023",Jail_Incarceration_Rates,False,False
TtlJlPrtrQ1,Pretrial Jail Population Rate (Q1),number,107.3,Pretrial Jail Population Rate (Q1),county-2023,Jail_Incarceration_Rates,False,False
TtlJlPrtrQ2,Pretrial Jail Population Rate (Q2),number,107.3,Pretrial Jail Population Rate (Q2),county-2023,Jail_Incarceration_Rates,False,False
TtlJlPrtrQ3,Pretrial Jail Population Rate (Q3),number,107.3,Pretrial Jail Population Rate (Q3),county-2023,Jail_Incarceration_Rates,False,False
TtlJlPrtrQ4,Pretrial Jail Population Rate (Q4),number,107.3,Pretrial Jail Population Rate (Q4),county-2023,Jail_Incarceration_Rates,False,False
TtlPrAPp,Prison Prison Admissions Count,integer,8115,Prison Prison Admissions Count,"county-2016, state-2022",Prison_Incarceration_Rates,False,False
TtlPrAPpr,Total Prison Admission Rate,number,140.33,Prison Prison Admissions Rate,"county-2016, state-2022",Prison_Incarceration_Rates,False,False
TtlPrPp,Total Prison Population Count,integer,21605,Total Prison Population Count,"county-2016, state-2022, state-2024",Prison_Incarceration_Rates,False,False
TtlPrPpr,Total Prison Population Rate,number,373.6,Total Prison Population Rate,"county-2016, state-2022, state-2024",Prison_Incarceration_Rates,False,False
TwoRaceE,Count Population identifying as two or more races,number,60.0,Count persons identifying as two or more races. Estimated count in non-decennial years.,"county-2010, county-2018, county-2023, state-2010, state-2018, state-2023, tract-2010, tract-2018, tract-2023, zcta-2018, zcta-2023",Race_Ethnicity,False,False
TwoRaceP,% Population identifying as two or more races,number,60.0,,"county-2010, county-2020, county-2023, state-2010, state-2018, state-2023, tract-2010, tract-2020, tract-2023, zcta-2020, zcta-2023",Race_Ethnicity,False,False
U50HcvD,Hepatitis C Deaths - Under 50 years old,integer,40,Hepatitis C deaths in populations under 50 years of age,"state-2013, state-2014, state-2015, state-2016, state-2017, state-2018, state-2019, state-2020, state-2021, state-2022",HepatitisC_Rates,False,False
Un50Hcv,Yearly Hepatitis C cases - Under 50 years old (2013-2016),number,9400,Mean yearly Hepatatis C cases in people under 50 years of age from 2013-2016,state-2017,HepatitisC_Rates,False,False
Und18P,% Population under 18 years old,number,60.0,,"county-2020, county-2023, tract-2020, tract-2023, zcta-2020, zcta-2023",Demographic_Characteristics,False,False
UnempP,Unemployment %,number,5.7,The number of unemployed individuals as a percentage of the civilian labor force,"county-1980, county-1990, county-2000, county-2010, county-2018, county-2020, county-2023, state-1980, state-1990, state-2000, state-2010, state-2018, tract-1980, tract-1990, tract-2000, tract-2010, tract-2018, tract-2020, tract-2023, zcta-2018, zcta-2020, zcta-2023",Economic_Characteristics,True,False
UnitDens,Housing Unit Density,number,46.11,Number of housing units per square mile of land area,"county-2018, county-2020, county-2023, state-2018, tract-2018, tract-2020, tract-2023, zcta-2018, zcta-2020, zcta-2023",Housing_Variables,False,False
UrbCoreInd,Urban Core Opportunity Index,number,-0.06,Raw Urban Core Opportunity Index (https://sdohatlas.github.io/),tract-sdoh-2014,SDOH_Indices,False,True
VacantP,Vacant Housing Units %,number,13.28,Percentage of vacant housing units,"county-1980, county-1990, county-2000, county-2010, county-2018, county-2020, county-2023, state-1980, state-1990, state-2000, state-2010, state-2018, tract-1980, tract-1990, tract-2000, tract-2010, tract-2018, tract-2020, tract-2023, zcta-2018, zcta-2020, zcta-2023",Housing_Variables,True,False
VetP,% Veteran Population,number,9.58,Percent of population that are veterans,"county-2010, county-2018, county-2020, county-2023, state-2010, state-2018, tract-2010, tract-2018, tract-2020, tract-2023, zcta-2018, zcta-2020, zcta-2023",Veteran_Population,False,False
WhiteE,Count White Population,number,56.2,Count persons with race identified as white alone. Estimated count in non-decennial years.,"county-1980, county-1990, county-2000, county-2010, county-2018, county-2023, state-1980, state-1990, state-2000, state-2010, state-2018, state-2023, tract-1980, tract-1990, tract-2000, tract-2010, tract-2018, tract-2023, zcta-2018, zcta-2023",Race_Ethnicity,True,False
WhiteP,% White Population,number,56.2,Percentage of population with race identified as white alone,"county-1980, county-1990, county-2000, county-2010, county-2018, county-2020, county-2023, state-1980, state-1990, state-2000, state-2010, state-2018, state-2023, tract-1980, tract-1990, tract-2000, tract-2010, tract-2018, tract-2020, tract-2023, zcta-2018, zcta-2020, zcta-2023",Race_Ethnicity,True,False
WhtHcvD,Hepatitis C deaths among White populations,number,60.0,,"state-2018, state-2019, state-2020, state-2021, state-2022",HepatitisC_Rates,False,False
WidwdP,% Population aged 15 and over who are widowed,number,60.0,,"county-2020, county-2023, tract-2020, tract-2023, zcta-2020, zcta-2023",Marital_Status,False,False
WlfrExp,Public welfare expenditures,integer,1897193,Total expenditures on public welfare programs,"state-2019, state-2020, state-2021, state-2022",Public_Expenditures,False,False
ZCTA5,Zip Code Tabulation Area,string,60637,"Census Bureau designated zip code tabulation area, or the rough area that contains five digit zip codes.","zcta-2018, zcta-2019, zcta-2020, zcta-2021, zcta-2022, zcta-2023, zcta-2025, zcta-ruca-2010",Geographic_Boundaries,True,False
