name,title,type,example,description,table_sources,metadata,longitudinal,analysis
NalxPresFr,Naloxone Law allowing pharmacists prescriptive authority (fraction of year in 2017),number,0,Fraction of year state has an effective Naloxone law allowing pharmacists prescriptive authority,"state-2017, state-2018, state-2019, state-2020, state-2021, state-2022",Naloxone_Policy,False,False
Ndvi,NDVI Average,number,0.06,"Average normalized difference vegetation index, a measure of greenness used to determine the amount of vegetation in an area, value from all pixel values in each Census tract","county-2018, state-2018, tract-2018, zcta-2018",Greenspace_Measures,False,False
NeighbTyp,Neighborhood Type,string,3,"Categorical, one of seven neighborhood (tract-level) typologies: 1 = Rural Affordable; 2 = Suburban Affluent; 3 = Suburban Affordable; 4 = Extreme Poverty; 5 = Multilingual Working; 6 = Urban Core Opportunity; 7 = Sparse Areas",tract-sdoh-2014,SDOH_Indices,False,False
NhPiHcvD,Hepatitis C deaths among Native Hawaiian and Pacific Islander populations ,number,60.0,,"state-2018, state-2019, state-2020, state-2021, state-2022",HepatitisC_Rates,False,False
NoIntP,Households without Internet Access %,number,8.79,Percentage of Households without Internet access,"county-2019, state-2019, tract-2019, zcta-2019",Internet_Access,False,False
NoLwRmUnc,Laws removing barriers to SSPs,boolean,0,"Dummy variable indicating whether the state has no law removing barriers or uncertainty as to SSP legality (0=no, 1=yes)",state-2019,Syringe_Policy,False,False
NoPrphLw,Drug Paraphernalia Laws,boolean,0,"Dummy variable indicating whether the state has no state drug paraphernalia law (0=no, 1=yes)",state-2019,Syringe_Policy,False,False
NonBlkHcv,Yearly Hepatitis C cases - non-Black (2013-2016),number,49000,Mean yearly Hepatitis C cases in populations non-Black other race/ethnicity populations 2013-2016,state-2017,HepatitisC_Rates,False,False
NonRelFhhP,% Nonrelatives in Family Households,number,3.35,Percent of people living in family households that are not related to family,"county-2018, county-2020, county-2023, state-2018, tract-2018, tract-2020, tract-2023, zcta-2018, zcta-2020, zcta-2023",Household_Characteristics,False,False
NonRelNfhhP,% Nonrelatives in Non-family Households,number,25.61,Percent of people living in non-family households that are not related,"county-2018, county-2020, county-2023, state-2018, tract-2018, tract-2020, tract-2023, zcta-2018, zcta-2020, zcta-2023",Household_Characteristics,False,False
NtPrFrDsSy,Distribution of Syringes Laws,boolean,0,"Dummy variable indicating whether the state law does not prohibit free distribution of syringes (0=no, 1=yes)",state-2019,Syringe_Policy,False,False
NvMrrdP,% Males aged 15 or older who never got married,number,60.0,,"county-2020, county-2023, tract-2020, tract-2023, zcta-2020, zcta-2023",Marital_Status,False,False
O75HcvD,Hepatitis C Deaths - Over 75 years old,integer,17,Hepatitis C deaths among populations over 75 years of age,"state-2013, state-2014, state-2015, state-2016, state-2017, state-2018, state-2019, state-2020, state-2021, state-2022",HepatitisC_Rates,False,False
OccupantP,% Occupied housing units,number,60.0,,"county-2020, county-2023, tract-2020, tract-2023, zcta-2020, zcta-2023",Household_Characteristics,False,False
OdMortRt,Overdose Mortality Rate,number,13.3,Overdose mortality rate,"county-2014, county-2015, county-2016, county-2017, county-2018, county-2019, county-2020, county-2021, state-2014, state-2015, state-2016, state-2017, state-2018, state-2019, state-2020, state-2021, state-2022",Opioid_Outcomes,False,False
OdMortRtAv,Overdose Mortality Rate Average (2016-2020),number,20.58,Average overdose mortality rate from 2016-2020,"county-2020, state-2020",Opioid_Outcomes,False,False
OpPdmpDt,Operational PDMP start date,date,1/1/2012,"Date when a â€œmodern systemâ€ became operational and users could access. Source: Horowitz et al., 2018, Table 2, column 4. This definition includes specific caveats adopted by Horowitz et al., 2018, described further below in Notes.","state-2017, state-2018, state-2019, state-2020, state-2021, state-2022, state-2023",PDMP_Presence,False,False
OpPdmpFr,Operational PDMP (fraction of year in 2017),number,1,"Fraction of year that state has a â€œmodern systemâ€ operational and users could access (as determined by Horowitz et al., 2018).","state-2017, state-2018, state-2019, state-2020, state-2021, state-2022, state-2023",PDMP_Presence,False,False
OpRxRt,Opioid Prescription Rate,number,39.5,Opioid prescription rate,"county-2020, county-2022, state-2020, state-2022",Opioid_Outcomes,False,False
OtherE,Count Other (race) Population,number,16.48,Count of Population with race not mentioned in any of the options above (includes two race or more races). Estimated count in non-decennial years.,"county-2010, county-2018, county-2023, state-2010, state-2018, state-2023, tract-2010, tract-2018, tract-2023, zcta-2018, zcta-2023",Race_Ethnicity,True,False
OtherP,% Other (race) Population,number,16.48,Percentage of Population with race not mentioned in any of the options above (includes two race or more races),"county-1980, county-1990, county-2000, county-2010, county-2018, county-2020, county-2023, state-1980, state-1990, state-2000, state-2010, state-2018, state-2023, tract-1980, tract-1990, tract-2000, tract-2010, tract-2018, tract-2020, tract-2023, zcta-2018, zcta-2020, zcta-2023",Race_Ethnicity,True,False
OtpAvTmDr,Driving Time (min) to nearest Opioid Treatment Program (OTP),number,24.18,Average driving time (minutes) across tracts to nearest opioid treatment program.,"county-2021, state-2021",Access_MOUDs,False,False
OtpCntDr,Count of Opioid Treatment Programs (OTP) (30-min drive),integer,1,Count of OTPs within a 30-minute driving threshold,"tract-2021, zcta-2021",Access_MOUDs,False,False
OtpCtTmDr,Tracts with Opioid Treatment Program (OTP) (30-min drive),integer,1092,Number of tracts within 30-min of opioid treatment program driving range,"county-2021, state-2021",Access_MOUDs,False,False
OtpMinDis,Distance to nearest OTP,number,121.0,"Euclidean distance* from tract/zip centroid to nearest OTP service location, in miles","tract-2021, zcta-2021",Access_MOUDs,False,False
OtpTmDr,Driving Time (min) to nearest Opioid Treatment Program (OTP),number,27.39,"Driving time from tract/zip origin centroid to the nearest tract/zip OTP destination centroid, in minutes","tract-2021, zcta-2021",Access_MOUDs,False,True
OtpTmDrP,% Tracts with Opioid Treatment Program (OTP) (30-min drive),number,0.75,Percent of tracts within a 30-minute drive time of an opioid treatment program.,"county-2021, state-2021",Access_MOUDs,False,False
Ov75Hcv,Yearly Hepatitis C cases - Over 75 years old (2013-2016),number,1600,Mean yearly Hepatitis C cases in people over 75 years of age from 2013-2016,state-2017,HepatitisC_Rates,False,False
Ovr16,Count persons over 16 years,number,60,,"county-1980, county-1990, county-2000, county-2018, county-2023, state-1980, state-1990, state-2000, state-2018, state-2023, tract-1980, tract-1990, tract-2000, tract-2018, tract-2023, zcta-2018, zcta-2023",Demographic_Characteristics,False,False
Ovr16P,% Population over 16 years,number,60.0,,"county-1980, county-1990, county-2000, county-2010, county-2018, county-2020, county-2023, state-1980, state-1990, state-2000, state-2010, state-2018, state-2023, tract-1980, tract-1990, tract-2000, tract-2010, tract-2018, tract-2020, tract-2023, zcta-2018, zcta-2020, zcta-2023",Demographic_Characteristics,False,False
Ovr18,Count persons over 18 years,number,60,,"county-1980, county-1990, county-2000, county-2018, county-2023, state-1980, state-1990, state-2000, state-2018, state-2023, tract-1980, tract-1990, tract-2000, tract-2018, tract-2023, zcta-2018, zcta-2023",Demographic_Characteristics,False,False
Ovr18P,% Population over 18 years,number,60.0,,"county-1980, county-1990, county-2000, county-2010, county-2018, county-2020, county-2023, state-1980, state-1990, state-2000, state-2010, state-2018, state-2023, tract-1980, tract-1990, tract-2000, tract-2010, tract-2018, tract-2020, tract-2023, zcta-2018, zcta-2020, zcta-2023",Demographic_Characteristics,False,False
Ovr21,Count persons over 21 years,number,60,,"county-1980, county-1990, county-2000, county-2018, county-2023, state-1980, state-1990, state-2000, state-2018, state-2023, tract-1980, tract-1990, tract-2000, tract-2018, tract-2023, zcta-2018, zcta-2023",Demographic_Characteristics,False,False
Ovr21P,% Population over 21 years,number,60.0,,"county-1980, county-1990, county-2000, county-2010, county-2018, county-2020, county-2023, state-1980, state-1990, state-2000, state-2010, state-2018, state-2023, tract-1980, tract-1990, tract-2000, tract-2010, tract-2018, tract-2020, tract-2023, zcta-2018, zcta-2020, zcta-2023",Demographic_Characteristics,False,False
Ovr62P,% Population over 62 years,number,60.0,,"county-2020, county-2023, tract-2020, tract-2023, zcta-2020, zcta-2023",Demographic_Characteristics,False,False
Ovr65,% Population: Age 65+,number,11.24,Percentage of population between ages of 15 & 24,"county-1980, county-1990, county-2000, county-2018, county-2023, state-1980, state-1990, state-2000, state-2018, state-2023, tract-1980, tract-1990, tract-2000, tract-2018, tract-2023, zcta-2018, zcta-2023",Demographic_Characteristics,True,False
Ovr65P,% Population: Age 65+,number,15.77,Percentage of population over 65,"county-1980, county-1990, county-2000, county-2010, county-2018, county-2020, county-2023, state-1980, state-1990, state-2000, state-2010, state-2018, state-2023, tract-1980, tract-1990, tract-2000, tract-2010, tract-2018, tract-2020, tract-2023, zcta-2018, zcta-2020, zcta-2023",Demographic_Characteristics,True,False
PacIsE,Count Native Hawaiian & Other PI Population,number,0.05,Count population with race identified as Native Hawaiian and Other Pacific Islander alone. Estimated count in non-decennial years.,"county-1980, county-1990, county-2000, county-2010, county-2018, county-2023, state-1980, state-1990, state-2000, state-2010, state-2018, state-2023, tract-1980, tract-1990, tract-2000, tract-2010, tract-2018, tract-2023, zcta-2018, zcta-2023",Race_Ethnicity,True,False
PacIsP,% Native Hawaiian & Other PI Population,number,0.05,Percentage of population with race identified as Native Hawaiian and Other Pacific Islander alone,"county-1980, county-1990, county-2000, county-2010, county-2018, county-2020, county-2023, state-1980, state-1990, state-2000, state-2010, state-2018, state-2023, tract-1980, tract-1990, tract-2000, tract-2010, tract-2018, tract-2020, tract-2023, zcta-2018, zcta-2020, zcta-2023",Race_Ethnicity,True,False
ParkArea,Park Area,number,39296898972.47,Area (in square meters) of park or green space in a state).,state-2022,Greenspace_Measures,False,False
PciE,Per Capita Income,integer,36888,Per capita income for individuals in the past 12 months (in 2018 inflation-adjusted dollars),"county-2010, county-2018, county-2020, county-2023, state-2010, state-2018, tract-2010, tract-2018, tract-2020, tract-2023, zcta-2018, zcta-2020, zcta-2023",Economic_Characteristics,False,False
PcpPer100k,Primary Care Physicians (PCP) per 100k,number,133.42,"PCPs per total Population X 100,000","county-providers-2010, tract-providers-2010",Healthcare_Provider_Access,False,True
PctBupT,% Tracts within 30-min Drive of Buprenorphine Provider,number,0.96,Percent of tracts with buprenorphine provider within a 30-min driving range,state-2020,Access_MOUDs,False,False
PctMetT,% Tracts within 30-min Drive of Methadone Provider,number,0.68,Percent of tracts with methadone provider within a 30-min driving range,state-2020,Access_MOUDs,False,False
PctNaltT,% Tracts within 30-min Drive of Naltrexone Provider,number,0.91,Percent of tracts with naltrexone provider within a 30-min driving range,state-2020,Access_MOUDs,False,False
PlcFyrExp,Police & fire expenditures,integer,1897193,Total expenditures on police and fire protection,"state-2019, state-2020, state-2021, state-2022",Public_Expenditures,False,False
PovP,Poverty %,number,16.6,Number of individuals earning below the poverty income threshold as a percentage of the total population,"county-1980, county-1990, county-2000, county-2010, county-2018, county-2020, county-2023, state-1980, state-1990, state-2000, state-2010, state-2018, tract-1980, tract-1990, tract-2000, tract-2010, tract-2018, tract-2020, tract-2023, zcta-2018, zcta-2020, zcta-2023",Economic_Characteristics,True,False
PrExcInj,Paraphernalia exludes objects used for injecting drugs,boolean,0,"Dummy variable indicating whether the paraphernalia definition in the state law explicitly exludes objects used for injecting drugs (0=no, 1=yes)",state-2019,Syringe_Policy,False,False
PrMsuseP,% Self-Report Misuse of Prescription Pain Medication (2020),number,4.15,Percent of persons who self-report misusing prescription pain relief medication in 2020.,"state-2020, state-2022",Opioid_Outcomes,False,False
PrNtRefInj,Paraphernalia does not refer to objects used for injecting drugs,boolean,0,"Dummy variable indicating whether the paraphernalia definition in the state law does not refer to objects used for injecting drugs (0=no, 1=yes)",state-2019,Syringe_Policy,False,False
PrcNtvRsrv,Native American & Tribal Lands,number,0.42,Percentage of county land area that belongs to Native American reservation(s),county-2017,Unique_Communities,False,False
RcaRuralP,% Tracts Rural (RUCA),number,0.01,Percent census tracts in the county classified as Rural using RUCA codes,county-2018,Urbanicity,False,False
RcaSubrbP,% Tracts Suburban (RUCA),number,0,Percent census tracts in the county classified as Suburban using RUCA codes,county-2018,Urbanicity,False,False
RcaUrbanP,% Tracts Urban (RUCA),number,0.99,Percent census tracts in the county classified as Urban using RUCA codes,county-2018,Urbanicity,False,False
RentalP,Rentals %,number,37.28,Percentage of occupied housing units that are rented,"county-2018, county-2020, county-2023, state-2018, tract-2018, tract-2020, tract-2023, zcta-2018, zcta-2020, zcta-2023",Housing_Variables,False,False
RetailP,Employed % - Retail,number,11.7,Percentage of population employed in retail trade industry,"county-2018, county-2020, county-2023, state-2018, tract-2018, tract-2020, tract-2023, zcta-2018, zcta-2020, zcta-2023",Employment_Trends,False,False
RlgPerCap,Religious institutions per capita,number,0.125,Religious institutions per capita by census tract,"tract-2018, tract-2023",Social_Capital,False,False
RspRt,Response Rate,number,94.7,Percent of units interviewed from total units intended for interview,"county-2018, county-2023",Social_Capital,False,False
Ruca1,Primary RUCA Code,string,1,Primary RUCA Code,"tract-ruca-2010, zcta-ruca-2010",Urbanicity,False,False
Ruca2,Secondary RUCA Code,string,1.1,Secondary RUCA Code,"tract-ruca-2010, zcta-ruca-2010",Urbanicity,False,False
Rurality,Urban-Suburban-Rural,string,Urban,Urban/Suburban/Rural,"tract-ruca-2010, zcta-ruca-2010",Urbanicity,False,True
RxAvTmDr,Avg. Driving Time (min) to nearest Pharmacy ,number,5.97,Average driving time (minutes) across tracts in state to nearest pharmacy.,"county-2019, state-2019",Access_Pharmacies,False,False
RxCntDr,Count of Pharmacies (30-min drive),integer,58,Count of pharmacies within a 30-minute driving threshold,"tract-2019, zcta-2019",Access_Pharmacies,False,False
RxCtTmDr,Tracts with Pharmacy (30-min drive),integer,1406,Number of tracts with pharmacy within a 30-min driving range,"county-2019, state-2019",Access_Pharmacies,False,False
RxMinDis,Distance (mi) to nearest Pharmacy,number,0.84,"Euclidean distance* from tract/zip centroid to nearest pharmacy, in miles","tract-2019, zcta-2019",Access_Pharmacies,False,False
RxTmDr,Driving Time (min) to nearest Pharmacy,number,0,"Driving time from tract/zip origin centroid to the nearest tract/zip pharmacy destination centroid, in minutes","tract-2019, zcta-2019",Access_Pharmacies,False,True
RxTmDrP,% tracts with Pharmacy (30-min drive),number,0.96,Percent of tracts with pharmacy within a 30-min driving range,"county-2019, state-2019",Access_Pharmacies,False,False
SRatio,Sex ratio for the total population (males per 100 females),number,60.0,,"county-1980, county-1990, county-2000, county-2010, county-2018, county-2020, county-2023, state-1980, state-1990, state-2000, state-2010, state-2018, state-2023, tract-1980, tract-1990, tract-2000, tract-2010, tract-2018, tract-2020, tract-2023, zcta-2018, zcta-2020, zcta-2023",Demographic_Characteristics,False,False
SRatio18,Sex ratio among adults aged 18 and older (males per 100 females),number,60.0,,"county-1980, county-1990, county-2000, county-2010, county-2018, county-2020, county-2023, state-1980, state-1990, state-2000, state-2010, state-2018, state-2023, tract-1980, tract-1990, tract-2000, tract-2010, tract-2018, tract-2020, tract-2023, zcta-2018, zcta-2020, zcta-2023",Demographic_Characteristics,False,False
SRatio65,Sex ratio among seniors aged 65 and older (males per 100 females),number,60.0,,"county-1980, county-1990, county-2000, county-2010, county-2018, county-2020, county-2023, state-1980, state-1990, state-2000, state-2010, state-2018, state-2023, tract-1980, tract-1990, tract-2000, tract-2010, tract-2018, tract-2020, tract-2023, zcta-2018, zcta-2020, zcta-2023",Demographic_Characteristics,False,False
SepartedP,% Males aged 15 years and over who are separated from their spouse,number,60.0,,"county-2020, county-2023, tract-2020, tract-2023, zcta-2020, zcta-2023",Marital_Status,False,False
SmokeP,Percentage of Smoking Population,number,0.162,Percentage of Smoking Population,"county-2025, state-2025",Smoking_Population,False,False
SocCapInd,Social Capital Index,number,0.26,"Composite index of LngTermP, LibPerCap, RlgPerCap","tract-2018, tract-2023",Social_Capital,False,False
SocEcAdvIn,Socioeconomic Advantage Index,number,1.17,Raw Socioeconomic Advantage Index (https://sdohatlas.github.io/),tract-sdoh-2014,SDOH_Indices,False,True
SomeCollegeP,"% Population 25 years and over with some college, but no degree",number,60.0,,"county-1980, county-1990, county-2000, county-2010, county-2018, county-2020, county-2023, state-1980, state-1990, state-2000, state-2010, state-2018, state-2023, tract-1980, tract-1990, tract-2000, tract-2010, tract-2018, tract-2020, tract-2023, zcta-2018, zcta-2020, zcta-2023",Educational_Characteristics,False,False
SpPer100k,Specialty Physicians per 100k,number,41.05,"Specialty Physicians per total Population X 100,000","county-providers-2010, tract-providers-2010",Healthcare_Provider_Access,False,False
StateArea,State Area,number,4486028684.18,Area (in square meters) of state,state-2018,Greenspace_Measures,False,False
SutCntDr,Count of Substance Use Treatment (SUT) facility (30-min drive),integer,4,Count of SUT services within a 30-minute driving threshold,"tract-2020, zcta-2020",Access_SubstanceUseTreatment,False,False
SutMinDis,Distance (mi) to Substance Use Treatment (SUT) facility,number,4.99,"Euclidean distance* from tract/zip centroid to nearest SUT service location, in miles","tract-2020, zcta-2020",Access_SubstanceUseTreatment,False,False
SutTmDr,Driving time (min) to Substance Use Treatment (SUT) facility,number,17.76,"Driving time from tract/zip origin centroid to the nearest tract/zip SUT destination centroid, in minutes","tract-2020, zcta-2020",Access_SubstanceUseTreatment,False,True
SutpAvTmDr,Driving Time (min) to nearest Substance Use Treatment program,number,9.96,Average driving time (minutes) across tracts in state to nearest Substance Use Treatment program.,"county-2020, state-2020",Access_SubstanceUseTreatment,False,False
SutpCtTmDr,Tracts with Substance Use Treatment (SUT) program (30-min drive),integer,1364,Number of tracts with Substance Use Treatment within a 30-min driving range.,"county-2020, state-2020",Access_SubstanceUseTreatment,False,False
SutpTmDrP,% tracts with Substance Use Treatment program (30-min drive),number,0.94,Percent of tracts with Substance Use Treatment program within a 30-minute driving range.,"county-2020, state-2020",Access_SubstanceUseTreatment,False,False
SviSmryRnk,Social Vulnerability Index (SVI) Summary Ranking,number,0.38,Overall summary ranking,"county-2018, county-2020, county-2022, tract-2018, tract-2020, tract-2022, zcta-2018, zcta-2022",Social_Vulnerability_Indices,False,False
SviTh1,Social Vulnerability Index (SVI) 1,number,0.43,"SVI Ranking, Theme 1: Socioeconomic","county-2018, county-2020, county-2022, tract-2018, tract-2020, tract-2022, zcta-2018, zcta-2022",Social_Vulnerability_Indices,False,True
SviTh2,Social Vulnerability Index (SVI) 2,number,0.3,"SVI Ranking, Theme 2: Household Composition & Disability","county-2018, county-2020, county-2022, tract-2018, tract-2020, tract-2022, zcta-2018, zcta-2022",Social_Vulnerability_Indices,False,False
SviTh3,Social Vulnerability Index (SVI) 3,number,0.2,"SVI Ranking, Theme 3: Minority Status & Language","county-2018, county-2020, county-2022, tract-2018, tract-2020, tract-2022, zcta-2018, zcta-2022",Social_Vulnerability_Indices,False,False
SviTh4,Social Vulnerability Index (SVI) 4,number,0.61,"SVI Ranking, Theme 4: Housing Type & Transportation","county-2018, county-2020, county-2022, tract-2018, tract-2020, tract-2022, zcta-2018, zcta-2022",Social_Vulnerability_Indices,False,True
TlBupAvTmBk,Average biking time to nearest telehealth buprenorphine provider,number,4.5,Average biking time (minutes) across tracts in county/state to nearest telehealth buprenorphine provider,,Access_MOUDs,False,False
TlBupAvTmDr,Average driving time to nearest telehealth buprenorphine provider,number,4.5,Average driving time (minutes) across tracts in county/state to nearest telehealth buprenorphine provider,,Access_MOUDs,False,False
TlBupAvTmWk,Average walking time to nearest telehealth buprenorphine provider,number,4.5,Average walking time (minutes) across tracts in county/state to nearest telehealth buprenorphine provider,,Access_MOUDs,False,False
TlBupCntBk30,Count of telehealth buprenorphine providers within 30-minute bike ride,integer,44,Total number of providers offering buprenorphine treatment via telemedicine/telehealth located within a 30-minute biking time threshold,,Access_MOUDs,False,False
TlBupCntDr30,Count of telehealth buprenorphine providers within 30-minute drive,integer,42,Total number of providers offering buprenorphine treatment via telemedicine/telehealth located within a 30-minute driving time threshold,,Access_MOUDs,False,False
TlBupCntDr60,Count of telehealth buprenorphine providers within 60-minute drive,integer,42,Total number of providers offering buprenorphine treatment via telemedicine/telehealth located within a 60-minute driving time threshold,,Access_MOUDs,False,False
TlBupCntWk30,Count of telehealth buprenorphine providers within 30-minute walk,integer,44,Total number of providers offering buprenorphine treatment via telemedicine/telehealth located within a 30-minute walking time threshold,,Access_MOUDs,False,False
TlBupCtTmBk30,Count of tracts within 30-min telehealth buprenorphine biking range,integer,44,Number of tracts with telehealth buprenorphine provider within a 30-min biking range,,Access_MOUDs,False,False
TlBupCtTmDr30,Count of tracts within 30-min telehealth buprenorphine driving range,integer,44,Number of tracts with telehealth buprenorphine provider within a 30-min driving range,,Access_MOUDs,False,False
TlBupCtTmDr60,Count of tracts within 60-min telehealth buprenorphine driving range,integer,44,Number of tracts with telehealth buprenorphine provider within a 60-min driving range,,Access_MOUDs,False,False
TlBupCtTmWk30,Count of tracts within 30-min telehealth buprenorphine walking range,integer,44,Number of tracts with telehealth buprenorphine provider within a 30-min walking range,,Access_MOUDs,False,False
TlBupMinDis,Minimum distance to telehealth buprenorphine provider,number,4.5,Euclidean distance (in miles) to the nearest provider offering buprenorphine treatment via telemedicine/telehealth services,"county-2025, state-2025",Access_MOUDs,False,False
TlBupTmBk,Biking time to nearest telehealth buprenorphine provider,number,4.5,Estimated biking time (in minutes) to the nearest provider offering buprenorphine treatment via telemedicine/telehealth services,"county-2025, state-2025",Access_MOUDs,False,False
TlBupTmBk30P,Percent of tracts within 30-min telehealth buprenorphine biking range,number,4.5,Percent of tracts with telehealth buprenorphine provider within a 30-min biking range,,Access_MOUDs,False,False
TlBupTmDr,Driving time to nearest telehealth buprenorphine provider,number,4.5,Estimated driving time (in minutes) to the nearest provider offering buprenorphine treatment via telemedicine/telehealth services,"county-2025, state-2025",Access_MOUDs,False,False
TlBupTmDr30P,Percent of tracts within 30-min telehealth buprenorphine driving range,number,4.5,Percent of tracts with telehealth buprenorphine provider within a 30-min driving range,,Access_MOUDs,False,False
TlBupTmDr60P,Percent of tracts within 60-min telehealth buprenorphine driving range,number,4.5,Percent of tracts with telehealth buprenorphine provider within a 60-min driving range,,Access_MOUDs,False,False
TlBupTmWk,Walking time to nearest telehealth buprenorphine provider,number,4.5,Estimated walking time (in minutes) to the nearest provider offering buprenorphine treatment via telemedicine/telehealth services,"county-2025, state-2025",Access_MOUDs,False,False
TlBupTmWk30P,Percent of tracts within 30-min telehealth buprenorphine walking range,number,4.5,Percent of tracts with telehealth buprenorphine provider within a 30-min walking range,,Access_MOUDs,False,False
